{
  "id": "6f970576-3994-4d25-8d76-346ac67840ae",
  "permanentLocationId": "fcd64ce1-6995-48f0-840e-89ffa2288371",
  "label": "2",
  "lowerBound": "E885 .N5",
  "upperBound": "F541 .M9",
  "mapTitle": "Annex",
  "mapUri": "http://minrva.library.illinois.edu/api/wayfinder/map/2_undergrad_2.png?x=459&y=130",
  "x": 459,
  "y": 130
}
