{
  "id": "24b9855e-20a8-404b-b62c-6ba5e851f3c3",
  "permanentLocationId": "fcd64ce1-6995-48f0-840e-89ffa2288371",
  "label": "1",
  "lowerBound": "E885 .N5",
  "upperBound": "F541 .M9",
  "mapTitle": "Main",
  "mapUri": "http://minrva.library.illinois.edu/api/wayfinder/map/1_undergrad_2.png?x=459&y=269",
  "x": 459,
  "y": 269
}